{
  "$schema": "https://json-schema.org/draft/2020-12/schema",
  "$id": "https://cristiannichifor.github.io/romania-reforms/schema/curti-apel.schema.json",
  "title": "Variant: one appellate court per development region",
  "description": "The paper proposes ~15 appellate courts, which is the number that already exists. This models the alternative of eight, one per development region. It is a variant chosen by the author after seeing that, not the paper's proposal, and carries variantOfPaper so nothing can quote it as the document's own.",
  "type": "object",
  "additionalProperties": false,
  "required": [
    "id",
    "title",
    "publisher",
    "period",
    "variantOfPaper",
    "provenance",
    "regions",
    "counties",
    "summary",
    "limitations"
  ],
  "properties": {
    "$schema": {
      "type": "string"
    },
    "id": {
      "const": "curti-apel-regiuni"
    },
    "title": {
      "type": "string"
    },
    "publisher": {
      "type": "string"
    },
    "period": {
      "type": "string"
    },
    "variantOfPaper": {
      "description": "Always true. This document does not model what the paper says.",
      "const": true
    },
    "provenance": {
      "$ref": "provenance.schema.json#/$defs/provenance"
    },
    "regions": {
      "type": "array",
      "minItems": 8,
      "maxItems": 8,
      "items": {
        "type": "object",
        "additionalProperties": false,
        "required": [
          "region",
          "counties",
          "seat",
          "seatSiruta",
          "seatCounty",
          "absorbs",
          "courtsToday",
          "volume",
          "judges"
        ],
        "properties": {
          "region": {
            "type": "string"
          },
          "counties": {
            "type": "array",
            "minItems": 2,
            "items": {
              "type": "string"
            }
          },
          "seat": {
            "type": "string"
          },
          "seatSiruta": {
            "type": "string"
          },
          "seatCounty": {
            "type": "string"
          },
          "absorbs": {
            "type": "array",
            "items": {
              "type": "string"
            }
          },
          "courtsToday": {
            "type": "integer",
            "exclusiveMinimum": 0
          },
          "volume": {
            "type": "number",
            "minimum": 0
          },
          "judges": {
            "type": "number",
            "minimum": 0
          }
        }
      }
    },
    "counties": {
      "type": "array",
      "minItems": 1,
      "items": {
        "type": "object",
        "additionalProperties": false,
        "required": [
          "county",
          "region",
          "metresToRegionSeat",
          "metresToNearestToday",
          "nearestRegion",
          "metresToNearestRegionSeat",
          "detourMetres",
          "nearerAnotherRegion"
        ],
        "properties": {
          "county": {
            "type": "string"
          },
          "region": {
            "type": "string"
          },
          "metresToRegionSeat": {
            "type": "number",
            "minimum": 0
          },
          "metresToNearestToday": {
            "type": "number",
            "minimum": 0
          },
          "nearestRegion": {
            "type": "string",
            "description": "Which of the eight regional seats is actually nearest by road."
          },
          "metresToNearestRegionSeat": {
            "type": "integer",
            "minimum": 0
          },
          "detourMetres": {
            "type": "integer",
            "description": "Own region's seat minus the nearest one. Zero when they are the same seat."
          },
          "nearerAnotherRegion": {
            "type": "boolean"
          }
        }
      }
    },
    "summary": {
      "type": "object",
      "additionalProperties": false,
      "required": [
        "today",
        "variant",
        "absorbed",
        "meanMetresToNearestToday",
        "meanMetresToRegionSeat",
        "countiesTravellingFurther",
        "countiesCompared",
        "countiesNearerAnotherRegion",
        "meanDetourMetres",
        "worstDetour"
      ],
      "properties": {
        "today": {
          "const": 15
        },
        "variant": {
          "const": 8
        },
        "absorbed": {
          "type": "integer"
        },
        "meanMetresToNearestToday": {
          "type": "number"
        },
        "meanMetresToRegionSeat": {
          "type": "number"
        },
        "countiesTravellingFurther": {
          "type": "integer"
        },
        "countiesCompared": {
          "type": "integer"
        },
        "countiesNearerAnotherRegion": {
          "type": "integer",
          "minimum": 0,
          "description": "Counties whose statutory region sends them past a nearer regional seat. The county tier's cross-border argument, one tier up."
        },
        "meanDetourMetres": {
          "type": "integer",
          "minimum": 0
        },
        "worstDetour": {
          "type": [
            "object",
            "null"
          ],
          "additionalProperties": false,
          "required": [
            "county",
            "region",
            "nearestRegion",
            "detourMetres"
          ],
          "properties": {
            "county": {
              "type": "string"
            },
            "region": {
              "type": "string"
            },
            "nearestRegion": {
              "type": "string"
            },
            "detourMetres": {
              "type": "integer"
            }
          }
        }
      }
    },
    "limitations": {
      "type": "array",
      "minItems": 1,
      "items": {
        "$ref": "provenance.schema.json#/$defs/limitation"
      }
    }
  }
}
