{
  "$schema": "../schema/curti-apel.schema.json",
  "id": "curti-apel-regiuni",
  "title": "Variantă: o curte de apel pe regiune de dezvoltare",
  "publisher": "Cristian Nichifor",
  "period": "2025",
  "variantOfPaper": true,
  "provenance": {
    "source": "reforma-sistem-judiciar-romania",
    "locator": "Variantă la Capitolul 7, care propune ~15 curți de apel",
    "confidence": "assumed",
    "note": "Lucrarea propune 15 curți de apel, adică exact câte există. Această variantă le reduce la 8, câte regiuni de dezvoltare are țara. Nu este propunerea lucrării și este marcată ca variantă peste tot."
  },
  "regions": [
    {
      "region": "București-Ilfov",
      "counties": [
        "B",
        "IF"
      ],
      "seat": "Curtea de Apel BUCUREŞTI",
      "seatSiruta": "179141",
      "seatCounty": "B",
      "absorbs": [],
      "courtsToday": 1,
      "volume": 65863,
      "judges": 88.4
    },
    {
      "region": "Centru",
      "counties": [
        "AB",
        "BV",
        "CV",
        "HR",
        "MS",
        "SB"
      ],
      "seat": "Curtea de Apel ALBA IULIA",
      "seatSiruta": "1017",
      "seatCounty": "AB",
      "absorbs": [
        "Curtea de Apel TÂRGU MUREŞ",
        "Curtea de Apel BRAŞOV"
      ],
      "courtsToday": 3,
      "volume": 29619,
      "judges": 42.4
    },
    {
      "region": "Nord-Est",
      "counties": [
        "BC",
        "BT",
        "IS",
        "NT",
        "SV",
        "VS"
      ],
      "seat": "Curtea de Apel IAŞI",
      "seatSiruta": "95060",
      "seatCounty": "IS",
      "absorbs": [
        "Curtea de Apel BACĂU",
        "Curtea de Apel SUCEAVA"
      ],
      "courtsToday": 3,
      "volume": 21463,
      "judges": 42.8
    },
    {
      "region": "Nord-Vest",
      "counties": [
        "BH",
        "BN",
        "CJ",
        "MM",
        "SJ",
        "SM"
      ],
      "seat": "Curtea de Apel CLUJ",
      "seatSiruta": "54975",
      "seatCounty": "CJ",
      "absorbs": [
        "Curtea de Apel ORADEA"
      ],
      "courtsToday": 2,
      "volume": 19261,
      "judges": 34.5
    },
    {
      "region": "Sud",
      "counties": [
        "AG",
        "CL",
        "DB",
        "GR",
        "IL",
        "PH",
        "TR"
      ],
      "seat": "Curtea de Apel PITEŞTI",
      "seatSiruta": "13169",
      "seatCounty": "AG",
      "absorbs": [
        "Curtea de Apel PLOIEŞTI"
      ],
      "courtsToday": 2,
      "volume": 20689,
      "judges": 33.7
    },
    {
      "region": "Sud-Est",
      "counties": [
        "BR",
        "BZ",
        "CT",
        "GL",
        "TL",
        "VN"
      ],
      "seat": "Curtea de Apel CONSTANŢA",
      "seatSiruta": "60419",
      "seatCounty": "CT",
      "absorbs": [
        "Curtea de Apel GALAŢI"
      ],
      "courtsToday": 2,
      "volume": 15945,
      "judges": 30.8
    },
    {
      "region": "Sud-Vest",
      "counties": [
        "DJ",
        "GJ",
        "MH",
        "OT",
        "VL"
      ],
      "seat": "Curtea de Apel CRAIOVA",
      "seatSiruta": "69900",
      "seatCounty": "DJ",
      "absorbs": [],
      "courtsToday": 1,
      "volume": 16105,
      "judges": 30.6
    },
    {
      "region": "Vest",
      "counties": [
        "AR",
        "CS",
        "HD",
        "TM"
      ],
      "seat": "Curtea de Apel TIMIŞOARA",
      "seatSiruta": "155243",
      "seatCounty": "TM",
      "absorbs": [],
      "courtsToday": 1,
      "volume": 9611,
      "judges": 22.3
    }
  ],
  "counties": [
    {
      "county": "AB",
      "region": "Centru",
      "metresToRegionSeat": 0,
      "metresToNearestToday": 0,
      "nearestRegion": "Centru",
      "metresToNearestRegionSeat": 0,
      "detourMetres": 0,
      "nearerAnotherRegion": false
    },
    {
      "county": "AG",
      "region": "Sud",
      "metresToRegionSeat": 0,
      "metresToNearestToday": 0,
      "nearestRegion": "Sud",
      "metresToNearestRegionSeat": 0,
      "detourMetres": 0,
      "nearerAnotherRegion": false
    },
    {
      "county": "AR",
      "region": "Vest",
      "metresToRegionSeat": 57147,
      "metresToNearestToday": 57147,
      "nearestRegion": "Vest",
      "metresToNearestRegionSeat": 57147,
      "detourMetres": 0,
      "nearerAnotherRegion": false
    },
    {
      "county": "BC",
      "region": "Nord-Est",
      "metresToRegionSeat": 139349,
      "metresToNearestToday": 0,
      "nearestRegion": "Nord-Est",
      "metresToNearestRegionSeat": 139349,
      "detourMetres": 0,
      "nearerAnotherRegion": false
    },
    {
      "county": "BH",
      "region": "Nord-Vest",
      "metresToRegionSeat": 170108,
      "metresToNearestToday": 0,
      "nearestRegion": "Nord-Vest",
      "metresToNearestRegionSeat": 170108,
      "detourMetres": 0,
      "nearerAnotherRegion": false
    },
    {
      "county": "BN",
      "region": "Nord-Vest",
      "metresToRegionSeat": 115843,
      "metresToNearestToday": 93954,
      "nearestRegion": "Nord-Vest",
      "metresToNearestRegionSeat": 115843,
      "detourMetres": 0,
      "nearerAnotherRegion": false
    },
    {
      "county": "BR",
      "region": "Sud-Est",
      "metresToRegionSeat": 195452,
      "metresToNearestToday": 31731,
      "nearestRegion": "Sud-Est",
      "metresToNearestRegionSeat": 195452,
      "detourMetres": 0,
      "nearerAnotherRegion": false
    },
    {
      "county": "BT",
      "region": "Nord-Est",
      "metresToRegionSeat": 115830,
      "metresToNearestToday": 40745,
      "nearestRegion": "Nord-Est",
      "metresToNearestRegionSeat": 115830,
      "detourMetres": 0,
      "nearerAnotherRegion": false
    },
    {
      "county": "BV",
      "region": "Centru",
      "metresToRegionSeat": 236753,
      "metresToNearestToday": 0,
      "nearestRegion": "Sud",
      "metresToNearestRegionSeat": 138925,
      "detourMetres": 97828,
      "nearerAnotherRegion": true
    },
    {
      "county": "BZ",
      "region": "Sud-Est",
      "metresToRegionSeat": 245390,
      "metresToNearestToday": 83445,
      "nearestRegion": "București-Ilfov",
      "metresToNearestRegionSeat": 124393,
      "detourMetres": 120997,
      "nearerAnotherRegion": true
    },
    {
      "county": "CJ",
      "region": "Nord-Vest",
      "metresToRegionSeat": 0,
      "metresToNearestToday": 0,
      "nearestRegion": "Nord-Vest",
      "metresToNearestRegionSeat": 0,
      "detourMetres": 0,
      "nearerAnotherRegion": false
    },
    {
      "county": "CL",
      "region": "Sud",
      "metresToRegionSeat": 265129,
      "metresToNearestToday": 136293,
      "nearestRegion": "Sud-Est",
      "metresToNearestRegionSeat": 136293,
      "detourMetres": 128836,
      "nearerAnotherRegion": true
    },
    {
      "county": "CS",
      "region": "Vest",
      "metresToRegionSeat": 98515,
      "metresToNearestToday": 98515,
      "nearestRegion": "Vest",
      "metresToNearestRegionSeat": 98515,
      "detourMetres": 0,
      "nearerAnotherRegion": false
    },
    {
      "county": "CT",
      "region": "Sud-Est",
      "metresToRegionSeat": 0,
      "metresToNearestToday": 0,
      "nearestRegion": "Sud-Est",
      "metresToNearestRegionSeat": 0,
      "detourMetres": 0,
      "nearerAnotherRegion": false
    },
    {
      "county": "CV",
      "region": "Centru",
      "metresToRegionSeat": 252469,
      "metresToNearestToday": 31482,
      "nearestRegion": "Sud",
      "metresToNearestRegionSeat": 170407,
      "detourMetres": 82062,
      "nearerAnotherRegion": true
    },
    {
      "county": "DB",
      "region": "Sud",
      "metresToRegionSeat": 71494,
      "metresToNearestToday": 57646,
      "nearestRegion": "Sud",
      "metresToNearestRegionSeat": 71494,
      "detourMetres": 0,
      "nearerAnotherRegion": false
    },
    {
      "county": "DJ",
      "region": "Sud-Vest",
      "metresToRegionSeat": 0,
      "metresToNearestToday": 0,
      "nearestRegion": "Sud-Vest",
      "metresToNearestRegionSeat": 0,
      "detourMetres": 0,
      "nearerAnotherRegion": false
    },
    {
      "county": "GJ",
      "region": "Sud-Vest",
      "metresToRegionSeat": 111732,
      "metresToNearestToday": 111732,
      "nearestRegion": "Sud-Vest",
      "metresToNearestRegionSeat": 111732,
      "detourMetres": 0,
      "nearerAnotherRegion": false
    },
    {
      "county": "GL",
      "region": "Sud-Est",
      "metresToRegionSeat": 208126,
      "metresToNearestToday": 0,
      "nearestRegion": "Sud-Est",
      "metresToNearestRegionSeat": 208126,
      "detourMetres": 0,
      "nearerAnotherRegion": false
    },
    {
      "county": "GR",
      "region": "Sud",
      "metresToRegionSeat": 171216,
      "metresToNearestToday": 78037,
      "nearestRegion": "București-Ilfov",
      "metresToNearestRegionSeat": 78037,
      "detourMetres": 93179,
      "nearerAnotherRegion": true
    },
    {
      "county": "HD",
      "region": "Vest",
      "metresToRegionSeat": 159752,
      "metresToNearestToday": 84932,
      "nearestRegion": "Centru",
      "metresToNearestRegionSeat": 84932,
      "detourMetres": 74820,
      "nearerAnotherRegion": true
    },
    {
      "county": "HR",
      "region": "Centru",
      "metresToRegionSeat": 233750,
      "metresToNearestToday": 104308,
      "nearestRegion": "Centru",
      "metresToNearestRegionSeat": 233750,
      "detourMetres": 0,
      "nearerAnotherRegion": false
    },
    {
      "county": "IF",
      "region": "București-Ilfov",
      "metresToRegionSeat": 12487,
      "metresToNearestToday": 12487,
      "nearestRegion": "București-Ilfov",
      "metresToNearestRegionSeat": 12487,
      "detourMetres": 0,
      "nearerAnotherRegion": false
    },
    {
      "county": "IL",
      "region": "Sud",
      "metresToRegionSeat": 251351,
      "metresToNearestToday": 132645,
      "nearestRegion": "București-Ilfov",
      "metresToNearestRegionSeat": 132645,
      "detourMetres": 118706,
      "nearerAnotherRegion": true
    },
    {